{
  "artifact_type": "signed_dispatch_receipt",
  "artifact_version": "0.9",
  "receipt_id": "dispatch_receipt_0d48a4d29448332d05c5daa9d5411c5d",
  "ledger_id": "ledger-example-1",
  "sequence": 2,
  "reservation_id": "res_cf4065b3fa944005a43b9c5044787396",
  "authorization_id": "authz_b3d6e0f0d004257fcdfdec05441fb8de",
  "transition": "reserved_to_dispatched",
  "state": "dispatched",
  "replayed": false,
  "occurred_at": "2026-07-22T16:03:00Z",
  "binding": {
    "adapter_id": "adapter-payment-refund",
    "adapter_revision": "adapter-rev-1",
    "arguments_hash": "args-hash-refund-25",
    "client_ref": "client-1",
    "context_hash": "context-hash-subject-1-client-1-workspace-1",
    "subject_ref": "subject-1",
    "tool_id": "tool-payment-refund",
    "tool_revision": "tool-rev-1",
    "workspace_ref": "workspace-1"
  },
  "execution_nonce": "dispatch_9b0f9559639c0b5aba3fd76b205fc3f5",
  "approval_nonce": "approval-nonce-runtime-example-1",
  "idempotency_key": "operation-123",
  "budget": {
    "amount": 25,
    "budget_ref": "budget-workspace-1",
    "currency": "EUR",
    "remaining_before": 100
  },
  "envelope_digest": "1a0d8f24690f2fc7536d1fdaf61a1e37fd5fdb05c06be0077cfbb6ca83da8881",
  "ledger_event_digest": "5bee0cdb38957fa9cab7d6a408190cd6b070f7a06a72e1816cb48bf609f1e475",
  "integrity": {
    "algorithm": "sha256",
    "digest": "42cbd050266c30d2f16beabc4d06e48615ff0bba955a2425be51766ce5f28797"
  },
  "signature": {
    "algorithm": "ed25519",
    "key_id": "dispatch-example-key-1",
    "value": "heeTwBU2j+N+G7tlyaOkkL73tAkCpeV9yWTFWAPT7wYam18SZJJIhnEnkd6IrMZIIfrFIhp1OSKSJjnOLug9BA=="
  }
}
